{
  "format": "hypraccel.mbd.graph",
  "version": 1,
  "id": "sensor_test_graph",
  "name": "Sensor Input Test",
  "nodes": [
    {
      "id": "sensor1",
      "type": "SensorInput",
      "label": "ADC Sensor",
      "params": {
        "source": "adc.channel0",
        "valueType": "number",
        "samplePeriodUs": 10000,
        "unit": "V",
        "hardwareResource": "adc.channel0"
      },
      "position": { "x": 100, "y": 100 }
    },
    {
      "id": "publish1",
      "type": "Publish",
      "label": "Sensor Telemetry",
      "params": {
        "topic": "telemetry/sensor/adc0",
        "transport": "telemetry",
        "retain": false
      },
      "position": { "x": 400, "y": 100 }
    }
  ],
  "edges": [
    {
      "id": "edge1",
      "from": { "node": "sensor1", "port": "value" },
      "to": { "node": "publish1", "port": "value" }
    }
  ]
}