{
  "format": "hypraccel.mbd.graph",
  "version": 1,
  "id": "phase_a_test",
  "name": "Phase A Test Graph",
  "nodes": [
    {
      "id": "const1",
      "type": "Constant",
      "label": "Constant 5.0",
      "params": { "value": 5.0 },
      "position": { "x": 100, "y": 100 }
    },
    {
      "id": "gain1",
      "type": "Gain",
      "label": "Gain 2.0",
      "params": { "gain": 2.0 },
      "position": { "x": 300, "y": 100 }
    },
    {
      "id": "add1",
      "type": "Add",
      "label": "Add",
      "params": {},
      "position": { "x": 500, "y": 100 }
    },
    {
      "id": "const2",
      "type": "Constant",
      "label": "Constant 3.0",
      "params": { "value": 3.0 },
      "position": { "x": 100, "y": 200 }
    },
    {
      "id": "const3",
      "type": "Constant",
      "label": "Constant 2.0",
      "params": { "value": 2.0 },
      "position": { "x": 100, "y": 250 }
    },
    {
      "id": "mult1",
      "type": "Multiply",
      "label": "Multiply",
      "params": {},
      "position": { "x": 300, "y": 200 }
    },
    {
      "id": "const4",
      "type": "Constant",
      "label": "Constant 10.0",
      "params": { "value": 10.0 },
      "position": { "x": 100, "y": 300 }
    },
    {
      "id": "publish1",
      "type": "Publish",
      "label": "Result",
      "params": { "topic": "telemetry/test", "transport": "telemetry", "retain": false },
      "position": { "x": 700, "y": 150 }
    }
  ],
  "edges": [
    { "id": "e1", "from": { "node": "const1", "port": "value" }, "to": { "node": "gain1", "port": "input" } },
    { "id": "e2", "from": { "node": "gain1", "port": "value" }, "to": { "node": "add1", "port": "a" } },
    { "id": "e3", "from": { "node": "const2", "port": "value" }, "to": { "node": "mult1", "port": "a" } },
    { "id": "e4", "from": { "node": "const3", "port": "value" }, "to": { "node": "mult1", "port": "b" } },
    { "id": "e5", "from": { "node": "mult1", "port": "value" }, "to": { "node": "add1", "port": "b" } },
    { "id": "e6", "from": { "node": "add1", "port": "value" }, "to": { "node": "publish1", "port": "value" } }
  ]
}
