{
  "format": "hypraccel.mbd.graph",
  "version": 1,
  "id": "actuator_test_graph",
  "name": "Actuator Output Test",
  "nodes": [
    {
      "id": "cordic1",
      "type": "CordicOp",
      "label": "Sine Generator",
      "params": {
        "operation": "sin",
        "implementation": "software",
        "iterations": 16
      },
      "position": { "x": 100, "y": 100 }
    },
    {
      "id": "actuator1",
      "type": "ActuatorOutput",
      "label": "PWM Motor",
      "params": {
        "target": "joint1.motor",
        "unit": "rad/s",
        "min": -1,
        "max": 1,
        "safeValue": 0,
        "hardwareResource": "pwm.motor0"
      },
      "position": { "x": 400, "y": 100 }
    }
  ],
  "edges": [
    {
      "id": "edge1",
      "from": { "node": "cordic1", "port": "value" },
      "to": { "node": "actuator1", "port": "command" }
    }
  ],
  "inputs": [
    {
      "name": "angle_rad",
      "type": "number",
      "unit": "rad"
    }
  ],
  "metadata": {
    "externalBindings": [
      {
        "input": "angle_rad",
        "to": { "node": "cordic1", "port": "angle_rad" }
      }
    ]
  }
}